city,section,subsection,text
Rome,See,Rome for kids,"Children's Museum . Via Flaminia 82. Just north of Piazza del Popolo. Controlled entrance at 10.00, 12,00, 15.00 and 17.00 for visits lasting 1 hour 45 minutes. Closed Mondays and for much of August. Best to check the web site for up-to-date info and to book in advance. Hands-on science, mainly for pre-teens, housed in a former tram-car depot."
Rome,See,Rome for kids,Bioparco . The renamed Rome Zoo. On the edge of the Borghese Gardens ( North Centre ).
Rome,See,Rome for kids,"The Time Elevator [dead link] . Via dei Santi Apostoli, 20 on a side street between Piazza Venezia and the Trevi Fountain. Daily 10.30 to 19.30. ""Five-dimensional"" shows on the Origins of Life and on the History of Rome, plus ""The House of Horrors"". Not for the faint-hearted: your seats move all over the place. Kids love it."
Rome,See,Rome for kids,"Rome's Wax Museum . 67 Piazza di Santi Apostoli, next to Piazza Venezia. Few good reports about this museum. Comments invited."
Rome,See,Rome for kids,Planetarium . This also has an excellent astronomy museum and is conveniently next to the Museum of Rome's Civilization ( EUR ).
Rome,See,Rome for kids,"The Vatican is, by and large, not a great idea for kids although they often enjoy the Sistine Chapel and are impressed by the beauty and the fact that it was all done in just four years. However, the Sistine Chapel is very crowded and getting there through the corridors of the Vatican Museum is even worse. It is easy for families to get separated so determine a meeting point. The best part of St. Peter's Basilica is that kids can go to the top of the dome. It is 500 steps but you can take the elevator up to the third floor. From there there are another 323 exhausting steps. So it is fun for older kids who can both climb up all the stairs and walk down as there is a huge line for the elevator ( Vatican )."
Rome,See,Rome for kids,"Zoomarine [dead link] . Dolphins, sea lions, exotic birds, splashy rides and swimming pools, some 20 km (12 mi) south of Rome near Pomezia. A good day out, but is this really why you came to Rome? Free transport from EUR and Pomezia railway station. Check web site for details."
Rome,Buy,,"Rome has excellent shopping opportunities of all kinds - from clothing and jewellery to art and antiques. You also get some big department stores, outlets and shopping centres, notably in the suburbs and outskirts."
Rome,Buy,,"Main shopping areas include Via del Corso, Via Condotti, and the surrounding streets. The finest designer stores are around Via Condotti, whilst Via del Corso has more affordable clothing, and Via Cola di Rienzo, and the surroundings of Via del Tritone, Campo de'Fiori, and Pantheon are the places to go for cheaper items. Upim is a good shop for cheap clothing of workable quality. Some brands (like Miss Sixty and Furla) are excellent, some are not as good - be sure to feel garments and try them on. There are also great quality shoes and leather bags at prices that compare well with the UK and US. Clothes in sizes bigger than a UK size 16/US 12 aren't always easy to find. Children's clothing can be expensive with basic vests (tank tops) costing as much as €21 in non-designer shops. If you really need to buy clothiers for kids try the Oviesse chain. Summer sales in many stores begin around July 15 and Rome also has New Year sales."
Rome,Buy,,"As mentioned above, Via Condotti leading from the Spanish Steps towards the Tiber is Rome's top haute couture fashion street (equivalent of Fifth Avenue in New York City, Via Montenapoleone in Milan, or Bond Street in London). Here, you can find big brand names such as Gucci, Armani, Dior, Valentino and Hermès, and several other high-class shops. However, the streets around the Via Condotti, such as Via Frattina, Via del Babuino, Via Borgognona and the Piazza di Spagna also offer some excellent high fashion boutiques, including Roberto Cavalli, Dolce & Gabbana, Versace, Prada and Givenchy (and several others). So once in the city, the big boutique names aren't absent. In these luxurious streets, however, you needn't only do clothing shopping - there are some really good and funky jewellery (e.g. Bulgari, Cartier, Tiffany's & Co.), pen and accessory (i.e. Mont Blanc) and artsy stores peppered here and there in these streets."
Rome,Buy,,"For department stores, Milan-based luxury department store chain La Rinascente has two flagship branches in Rome; one along Via de Tritone, near the Trevi Fountain, in which you can see the Roman aqueduct carrying water to the Trevi Fountain in the basement, and the other one on Piazza Fiume."
Rome,Buy,,"If you want to spend a day in a large shopping mall , there's the Euroma2 with about 230 shops (mainly clothes and accessories) and restaurants, to be found near the EUR district. Take Metro B line from Termini to EUR Palasport station, cross the road and take the frequent free bus (ride takes 5–15 minutes) to the mall. In addition to many shops and food, the conditioned air and free toilets may be a welcome relief if you are in Rome during mid-summer."
Rome,Buy,,"There are lots of fake plastic 'Louis Vuitton' bags being sold at the side of the road. Be aware, that buying of fake products is illegal in Italy. Fines up to €1000 have been reported. If you are happy to take the risk, make sure you haggle; unsuspecting tourists pay up to €60 for them."
Rome,Buy,,"If you want to buy souvenirs or gifts, a museum would be the worst choice since there are many stalls along the streets of tourist areas that offer reasonable prices. It is likely that the same item in the gift shop of any museum will cost much more."
Rome,Buy,,"Castel Romano . Near Rome, along the Via Pontina highway. A very large Factory Outlet with more than 100 branded shops. A car is needed to reach the place but a 30% discount in a designer shop is surely worth the 20 km (12 mi) trip."
Rome,Buy,,"[dead link] Valmontone . A little further away from Rome than Castel Romano, you can find Valmontone outlet on the motorway towards Napoli just 50 km (31 mi) far from Rome. Valmontone itself is a delightful little town - 30 mins by train."
Rome,Buy,Factory outlets,"Castel Romano . Near Rome, along the Via Pontina highway. A very large Factory Outlet with more than 100 branded shops. A car is needed to reach the place but a 30% discount in a designer shop is surely worth the 20 km (12 mi) trip."
Rome,Buy,Factory outlets,"[dead link] Valmontone . A little further away from Rome than Castel Romano, you can find Valmontone outlet on the motorway towards Napoli just 50 km (31 mi) far from Rome. Valmontone itself is a delightful little town - 30 mins by train."
Rome,Eat,,"Rome is full of good restaurants, many in attractive settings, particularly when you sit outside in the evening. No one location can be recommended to search for a good restaurant: some of the best places to eat are in the most unpromising locations while well-situated restaurants can often live on their reputation rather than the quality of their food. Restaurants in guidebooks can be good but prices can be inflated because it is more than likely a ""tourist trap"". To find an authentic restaurant that won't break the bank, try to find a place in a more residential area or somewhere that isn't in the middle of the tourist locations."
Rome,Eat,,In Rome you can ask for:
Rome,Eat,,"Many of the good restaurants in Rome are hard to find, but a good tip is to go where Italians live and eat. The downside is that waitstaff at these restaurants usually do not speak English, so be prepared to have to speak some Italian. On the top of the green, old mountain (Monte Verde Vecchio) there are some trattorias with authentic Italian cuisine at an affordable price. Rome also has many beautiful spots to eat, so buying some delicacies to make up a picnic can be a great experience. In Via Marmorata you find Volpetti's which is known for its amazing selection of cheese, prosciutto and delicious pastries (and also for its prices!). A more affordable choice is to go to a local supermarket which will also have good fresh foods for lunch."
Rome,Eat,,"Most pizza restaurants serve it only in the evening. Try some of the fried things like baccala (battered salt cod) for a starter, followed by a pizza for a really Roman meal.  Roman pizzas tend to be very thin crusted. Avoid the tourist areas where you'll often pay double the going rate just to get a badly reheated frozen pizza. Your best bet is to cross the river and find a restaurant in Trastevere--the food is authentic and a lot cheaper than in the rest of downtown Rome. Make sure you eat it with a fork and knife; Romans don't eat this kind of pizza with their hands."
Rome,Eat,,"Pizza al Taglio is pizza with a thicker crust, cooked in a large pan. This is served by the piece, usually to take away, and is a good cheap way to get something to fill you up.  Point to the one you want, indicate if you want more or less than your server is indicating with the knife.  It's sold by weight (the listed price is usually per 100 g, known as an etto , short for ettogrammo , i.e. hectogram). This kind of pizza is eaten with the slices stacked on top of each other like a sandwich."
Rome,Eat,,"Look for a gelateria . Remember that it usually costs extra to sit inside. You pay for your ice cream first... take your receipt and go fight your way through the throng to choose your flavors (Italians don't believe in lines).  You will be asked "" Panna? "" when it's almost made - this is the offer of whipped cream on top.  If you've already paid, this is free."
Rome,Eat,,"There are a few signs to keep in mind: "" Produzione Propria "" (homemade - our own production), "" Nostra Produzione "" (our production), "" Produzione Artigianale "" (production by craftsmen). If the colours seem dull and almost ugly it is probably natural, the bright colours being just a mix. Also, fancy flavours like Kinder Egg chocolate is a dead giveaway that the place isn't about  traditional gelato. Keep in mind, Italians usually won't queue, but if they are in line for gelato, get in line yourself: you may have hit the jackpot. Producers to try include Gelato di San Crispino ; Giolitti ; and Fassi ."
Rome,Eat,,"Vegetarians should have an easy time. Buffets in many restaurants usually have a good range of delicious vegetarian stuff - e.g. gratinated roast peppers/aubergines, etc. Vegans should do all right too; pizzas don't always have cheese - a Marinara for example, is just tomato, garlic and oregano."
Rome,Eat,,"While there is not much choice, at least Rome's Kosher cooking is truly excellent.  Try La Taverna del Ghetto in the heart of the Jewish Quarter."
Rome,Eat,,"More places can be found near the synagogue in via Padova, close to the ""La Sapienza"" university and the Bologna underground station."
Rome,Eat,,"You can get cheap food in Rome, the problem is that if you don't know the city well or are forced to eat out in the centre, the prices go up."
Rome,Eat,,"Chinese restaurants are still quite cheap but other ethnic restaurants (Thai, Indian) are generally expensive (think €30 upwards per person). Sushi is very expensive (€40 minimum per person)."
Rome,Eat,,Waiters have been known to take advantage of patrons by bringing more expensive items than what was ordered or asking for a tip although it's not mandatory and should be included in the price by law.
Rome,Eat,,"Carciofi alla romana - Artichokes, Roman style"
Rome,Eat,,"Carciofi alla giudia - Artichokes, Jewish style"
Rome,Eat,,Puntarelle - Chicory salad
Rome,Eat,,"Bucatini all'amatriciana - A pasta dish made with guanciale (cured pork cheeks), pecorino romano and tomatoes"
Rome,Eat,,"Spaghetti (or Rigatoni) alla carbonara - A sauce made with yolk, pecorino and guanciale (cured pork cheeks)"
Rome,Eat,,"Abbacchio a ""scottadito"" - Lamb chops"
Rome,Eat,,Scaloppine alla romana - Veal sautéed with fresh baby artichokes
Rome,Eat,,Coda alla vaccinara - Oxtail stew
Rome,Eat,,Cornetto & cappuccino - Sweet pastry and coffee
Rome,Eat,,Pizza a taglio - Pizza by the slice
Rome,Eat,,Panino - Italian sandwich
Rome,Eat,,"Trippa alla romana - Tripe in a sauce based on tomatoes, onions, garlic, extra-virgin olive oil, wine or vinegar, etc."
Rome,Eat,,Fiori di zucca fritti - Deep-fried zucchini flowers
Rome,Eat,,"€3.50 - You buy the pizza and eat it walking around, since it's a bread shop with no sitting area. You can choose how much you want to eat, but you'll be spending about €2 per slice + about €1.50 for a can of soda or €1 for water."
Rome,Eat,,"€15-20 - At lunchtime if you go to a restaurant you'll be spending between €15 for a set menu (not always good, try to go where you see Italian office people having their lunch as your best bet) and €20. For this you should get a pasta dish and a second course (meat) ending with coffee. Obviously if you have special wine the price will increase."
Rome,Eat,,"€20 - At night you can spend about €20 at a pizza restaurant or if you have only one main course. Again, if you have special wine it will cost more. The cheapest food you can get at a decent restaurant is a pizza marinara (that is, without cheese) for about €6. The price goes up from there depending on the toppings."
Rome,Eat,,€20+ - For a sit down lunch or dinner in a restaurant €20 is cheap and if you want you can go up to €200 a head.
Rome,Eat,,"Eat like a Roman In Rome you can ask for: Carciofi alla romana - Artichokes, Roman style Carciofi alla giudia - Artichokes, Jewish style Puntarelle - Chicory salad Bucatini all'amatriciana - A pasta dish made with guanciale (cured pork cheeks), pecorino romano and tomatoes Spaghetti (or Rigatoni) alla carbonara - A sauce made with yolk, pecorino and guanciale (cured pork cheeks) Abbacchio a ""scottadito"" - Lamb chops Scaloppine alla romana - Veal sautéed with fresh baby artichokes Coda alla vaccinara - Oxtail stew Cornetto & cappuccino - Sweet pastry and coffee Pizza a taglio - Pizza by the slice Panino - Italian sandwich Trippa alla romana - Tripe in a sauce based on tomatoes, onions, garlic, extra-virgin olive oil, wine or vinegar, etc. Fiori di zucca fritti - Deep-fried zucchini flowers"
Rome,Eat,Pizza,"Most pizza restaurants serve it only in the evening. Try some of the fried things like baccala (battered salt cod) for a starter, followed by a pizza for a really Roman meal.  Roman pizzas tend to be very thin crusted. Avoid the tourist areas where you'll often pay double the going rate just to get a badly reheated frozen pizza. Your best bet is to cross the river and find a restaurant in Trastevere--the food is authentic and a lot cheaper than in the rest of downtown Rome. Make sure you eat it with a fork and knife; Romans don't eat this kind of pizza with their hands."
Rome,Eat,Pizza,"Pizza al Taglio is pizza with a thicker crust, cooked in a large pan. This is served by the piece, usually to take away, and is a good cheap way to get something to fill you up.  Point to the one you want, indicate if you want more or less than your server is indicating with the knife.  It's sold by weight (the listed price is usually per 100 g, known as an etto , short for ettogrammo , i.e. hectogram). This kind of pizza is eaten with the slices stacked on top of each other like a sandwich."
Rome,Eat,Ice cream (gelato),"Look for a gelateria . Remember that it usually costs extra to sit inside. You pay for your ice cream first... take your receipt and go fight your way through the throng to choose your flavors (Italians don't believe in lines).  You will be asked "" Panna? "" when it's almost made - this is the offer of whipped cream on top.  If you've already paid, this is free."
Rome,Eat,Ice cream (gelato),"There are a few signs to keep in mind: "" Produzione Propria "" (homemade - our own production), "" Nostra Produzione "" (our production), "" Produzione Artigianale "" (production by craftsmen). If the colours seem dull and almost ugly it is probably natural, the bright colours being just a mix. Also, fancy flavours like Kinder Egg chocolate is a dead giveaway that the place isn't about  traditional gelato. Keep in mind, Italians usually won't queue, but if they are in line for gelato, get in line yourself: you may have hit the jackpot. Producers to try include Gelato di San Crispino ; Giolitti ; and Fassi ."
Rome,Eat,Vegetarians,"Vegetarians should have an easy time. Buffets in many restaurants usually have a good range of delicious vegetarian stuff - e.g. gratinated roast peppers/aubergines, etc. Vegans should do all right too; pizzas don't always have cheese - a Marinara for example, is just tomato, garlic and oregano."
Rome,Eat,Kosher dining,"While there is not much choice, at least Rome's Kosher cooking is truly excellent.  Try La Taverna del Ghetto in the heart of the Jewish Quarter."
Rome,Eat,Kosher dining,"More places can be found near the synagogue in via Padova, close to the ""La Sapienza"" university and the Bologna underground station."
Rome,Eat,Pricing,"You can get cheap food in Rome, the problem is that if you don't know the city well or are forced to eat out in the centre, the prices go up."
Rome,Eat,Pricing,"Chinese restaurants are still quite cheap but other ethnic restaurants (Thai, Indian) are generally expensive (think €30 upwards per person). Sushi is very expensive (€40 minimum per person)."
Rome,Eat,Pricing,Waiters have been known to take advantage of patrons by bringing more expensive items than what was ordered or asking for a tip although it's not mandatory and should be included in the price by law.
Rome,Eat,Pricing,"€3.50 - You buy the pizza and eat it walking around, since it's a bread shop with no sitting area. You can choose how much you want to eat, but you'll be spending about €2 per slice + about €1.50 for a can of soda or €1 for water."
Rome,Eat,Pricing,"€15-20 - At lunchtime if you go to a restaurant you'll be spending between €15 for a set menu (not always good, try to go where you see Italian office people having their lunch as your best bet) and €20. For this you should get a pasta dish and a second course (meat) ending with coffee. Obviously if you have special wine the price will increase."
Rome,Eat,Pricing,"€20 - At night you can spend about €20 at a pizza restaurant or if you have only one main course. Again, if you have special wine it will cost more. The cheapest food you can get at a decent restaurant is a pizza marinara (that is, without cheese) for about €6. The price goes up from there depending on the toppings."
Rome,Eat,Pricing,€20+ - For a sit down lunch or dinner in a restaurant €20 is cheap and if you want you can go up to €200 a head.
Rome,Drink,,"Starbucks has long avoided Rome, but in April 2023 the first one appeared in the center of Rome. And no wonder: Italian coffee is great so our friends from Seattle would face a lot of competition. A latte in Italian is just a glass of milk. If you're expecting coffee in that glass, you should ask for a caffe latte . A latte macchiato (meaning ""marked"") is steamed milk stained with a smaller shot of espresso.  ""Espresso"" or ""normale"" is just that, but more commonly just referred to as caffe . Espresso doppio means a double shot of espresso, while espresso macchiato is espresso 'marked' with a dab of steamed milk. Americano — the one to order if you like filter coffee  — is espresso diluted with hot water and not drunk much by Italians. Cappuccino is well known outside of Italy, but be warned: it is considered very un-classy, and somewhat childish, to order one after 11AM  (and certainly after a meal). Decaffeinato is self-explanatory, but often referred to by the common brand-name Caffe Hag ."
Rome,Drink,,"House wines are almost always drinkable and inexpensive. You are better off ordering a bottle rather than house wine in most establishments in Rome due to some places watering down their wines. You may often find a bottle of wine on the table for you. Believe it or not: this bottle will be less expensive than a glass would be in the US or UK, possibly only €4 or €5. This does not always apply to those places that look really tourist-trap-like! Slightly better quality wines are usually sold at a relatively small mark-up on shop prices. Most Romans drink water with their meals. In restaurants it normally comes in 1 litre bottles and can be had normale (still water) or gassata (carbonated water)."
Rome,Drink,,"Water is free at designated water fountains , called ""nasone"" (big nose). Some of these date back to ancient times, and the water is still very good. It's fresh spring water coming from the famous underground springs of Rome and is safe to drink. If you carry an empty bottle, fill it up for the rest of the day. Look for the drinking fountain with constant running water, plug the bottom hole, and cool water will shoot up from a smaller hole on top of the tap. Don't put your lips round the hole at the bottom, as stray dogs tend to like to get a drink."
Rome,Drink,,"Pre-dinner drinks ( aperitivi ) accompanied with small hors d'oeuvres (antipasti) are very popular with Romans:
1) chic yuppies in their 20s-30s crowd the area around Piazza delle Coppelle (behind the Parliament) and Piazza di Pietra (near the Chamber of Commerce);
2) younger generations sprawl around the square and streets of Campo de' Fiori ;
3) everyone sits to drink in the narrow streets behind the Pantheon ( Piazza Pasquino and Via del Governo Vecchio )."
Rome,Drink,,"Given a heart for exploration, Testaccio is the place to wander for after-dinner partying on the weekends. Head down there around 23:00 (take metro Line B and get off at Piramide station) and listen for music. There are usually loads of people simply walking through the streets or looking for parking. Be brave, walk in, meet some wonderful Romans. This area is best in the winter.  In the summer, the dancing moves to Ostia and Fregene, 45 minutes by car from Rome, at the seaside. Many clubs in Rome close in the summer months."
Rome,Drink,,"Many visitors like to go on Roman pub crawls.  The Colosseum Pub Crawl for example, has been throwing parties since 1999."
Rome,Drink,,"To the east of Termini Station , and near the first University of Rome ""La Sapienza"", is  the San Lorenzo district, where you will find many pubs and clubs where university students and young Romans in their twenties spend their nights. On Saturday night the streets are crowded with people moving from one pub to another. On the city side of the railway, near Santa Maria Maggiore Cathedral, are some great Irish pubs, i.e. the Fiddler's Elbow , the oldest in Rome, where many English-speaking residents and Italian customers like to sip their pints. It's a good place to meet Romans who speak English. Also nearby are the Druid's Den and the Druid's Rock ."
Rome,Drink,,"On Via Nazionale there's a huge and beautiful pub called The Flann o'Brien [dead link] , one of the biggest in Rome. On the same street near Piazza Venezia there is another cluster of pubs including The Nag's Head Scottish Pub . After 22.00 it's very expensive as it becomes more like a disco. Entrance with first drink costs €13 and drinks cost €8. Before midnight they sometimes host live music concerts. In the same area, at the beginning of Via Vittorio Emanuele II you can find The Scholar's Lounge Irish pub with nice music. This is definitely worth a look but there is no room to dance. During winter American colleges students residents in Rome end up their highly alcoholic nights here.
Also nearby there's the Trinity College Irish Pub . Drinks are quite expensive there."
Rome,Drink,,"Also on Via Vittorio Emanuele, near Piazza Navona , there's the Bulldog's Inn English pub . DJs play very good music there and there's room to dance, although few do. Nearby in Campo dei fiori there are several crowded pubs. Beware, there have been huge and serious fights there. In the narrow streets behind Piazza Navona there are also many places to go. Try Jonathan's Angels in Via del Fico. Also the Abbey Theatre Irish pub is a good place in Via del Governo Vecchio."
Rome,Drink,,"On the other side of the River Tiber (Tevere) is Trastevere district where there are many places to eat and drink. This is also a good place where to enjoy a walk in crowded streets at night. In summer time on Isola Tiberina , the island in the Tiber, temporary bar are built and there are all sorts of things to do."
Rome,Drink,,"Far from the centre there are some other good places. The Palacavicchi in a small suburban town called Ciampino is a multi-dance room area where they play different kinds of music, mostly Latin American. You definitely need to get a cab to get there and it won't cost less than €20. South of Ciampino Airport there is The Ice Club for ice skating, and the Kirby's [dead link] and the Geronimo pubs. All of them are nice places. At the Geronimo pub before midnight there usually are live music concerts with many bands covering different genres. On Friday and Saturday nights after the concert they play disco music. Entrance is free and you may drink and eat as you feel. Very cool place and for every budget. Unfortunately you need a cab to get there."
Rome,Drink,,"Those Romans who speak fluent English usually have a great deal of confidence with tourists, so just offer them a beer and they will be glad to share with you their tip & tricks about night life in Rome."
Rome,Drink,,"Discos:
There are many beautiful discos. Unfortunately the city is huge and it's not very easy to find them, unless you have a very good guide."
